questions,keywords,keywords_result
What is the geographical location of Thailand?,Thailand,geographical location Thailand
How is the economy of the Netherlands performing?,Netherlands,economy Netherlands performing
What are the main industries in Georgia?,Georgia,main industries Georgia
What is the size and population of China?,country China,size population China
How has Bangladesh been affected by recent natural disasters?,Bangladesh,Bangladesh  natural disasters
What are some tourist attractions in Alexandria?,Alexandria,tourist attractions Alexandria
What is the population of Xiaogan China?,Xiaogan,population Xiaogan China
Can you provide information about Glendale a city in the United States?,city Glendale,Glendale city United States
What are the popular attractions in Granada Spain?,city Granada,popular attractions Granada Spain
Where is Lake Kariba located and what are its notable features?,Lake Kariba,Lake Kariba located notable features
How is Niger's economy structured?,Niger,Niger economy structured
What countries border the Arabian Sea?,Arabian Sea,countries  border  Arabian Sea
What is the significance of Sardegna in Italy?,Sardegna,Sardegna Italy
What is the Arab Cooperation Council and what is its purpose?,Arab Cooperation Council,Arab Cooperation Council  purpose
Can you provide information about the World Labor Organization?,world labor,World Labor Organization
What is the Islamic Conference and what countries are its members?,Islamic Conference,Islamic Conference  members
What is the 30 Group and what is its role in international affairs?,30 group,30 Group  role  international affairs
How does the Caribbean Economic Community promote regional integration?,Caribbean economic,Caribbean Economic Community  regional integration
Can you provide information about the relationship between Slovakia and Hungary?,slovakia hungary,Slovakia Hungary relationship
How does Mongolia cooperate with China?,mongolia china,Mongolia  China  cooperate
What are the economic ties between Niger and Algeria?,niger algeria,economic ties  Niger  Algeria
How does Kuwait's economy compare to that of Saudi Arabia?,kuwait saudi arabia,Kuwait economy  Saudi Arabia economy
What is the current situation in Lebanon and Syria?,lebanon syria,Lebanon  Syria
How is the economy of Cameroon performing?,Cameroon economy,economy Cameroon performing
What is the GDP of Nigeria and what are its main sources of revenue?,Nigeria gdp,GDP Nigeria main sources of revenue
Can you provide information about the political landscape of Mongolia?,Mongolia Republic,political landscape Mongolia
Tell me about Kiribati politics,Kiribati politics,Kiribati politics
Tell me about Poland language,Poland  language,Poland language
What is the significance of the Galician language in Spain?,Spain Galician,Galician language  Spain
Tell me about Uzbekistan eastern orthodox,Uzbekistan eastern orthodox,Uzbekistan eastern orthodox
Can you provide information about the religion in Haiti?,Haiti religion,religion Haiti
What are the major ethnic groups in Suriname?,Suriname ethnic group,major ethnic groups Suriname
How is the German language used in Slovakia?,Slovakia German,German language  Slovakia
What organization does Cape Verde belong to?,poland cape verde organization,Cape Verde
What is the relationship between Saint Kitts and Cambodia?,saint kitts cambodia,Saint Kitts  Cambodia
Can you provide information about the organization in the Marshall Islands and Grenadines?,marshall islands grenadines organization,organization Marshall Islands Grenadines
What organization does Cote d'Ivoire belong to?,czech republic cote divoire organization,Cote d'Ivoire
What is the relationship between Panama and Oman?,panama oman,Panama  Oman
Can you provide information about Iceland's relationship with Mali?,iceland mali,Iceland  Mali
What is the current situation in Guyana and Sierra Leone?,guyana sierra leone,current situation Guyana Sierra Leone
How does Mauritius interact with India?,mauritius india,Mauritius  India
Can you provide information about Vanuatu's relationship with Afghanistan?,vanuatu afghanistan,Vanuatu Afghanistan relationship
What is the current political situation in Libya?,libya australia,political situation Libya
Can you provide information about the Hutu population in Africa?,Hutu Africa,Hutu population Africa
How does Serbia interact with Europe?,Serb Europe,Serbia  Europe
"Telle me informations about Uzbekistan, Asia?",Uzbek Asia,Uzbekistan  Asia
"Can you provide information about Rheine, a city in Germany?",Rheine Germany,Rheine  city  Germany
What is the significance of the Nile River in Egypt?,Egypt Nile,Nile River  Egypt
